{
  "schema": "td613.sequence5.5.execution-receipt/v4.1",
  "episode_id": "EPISODE_SACRIFICIAL_PILOT_V4_1",
  "execution_id": "EXEC-V4-1-UNIT_K1_PILOT-V4-03A-attempt-0",
  "unit_id": "UNIT_K1_PILOT-V4-03A",
  "arm": "K1",
  "fixture_id": "PILOT-V4-03A",
  "is_pilot": true,
  "receiver_identity": {
    "provider": "google",
    "exact_model_id": "gemini-3.8-flash",
    "runtime_or_harness": "vercel-preview/server-fetch",
    "endpoint_or_execution_class": "https://generativelanguage.googleapis.com/v1beta/models/gemini-3.8-flash:generateContent",
    "model_settings": {
      "temperature": null,
      "sampling_parameters_set_by_protocol": false,
      "thinking_level": "medium",
      "max_output_tokens": 8192,
      "response_mime_type": "application/json",
      "tool_permissions": []
    }
  },
  "credential_and_billing_provenance": {
    "credential_source_type": "VERCEL_ENVIRONMENT_VARIABLE",
    "credential_source_name": "GEMINI_API_KEY",
    "credential_fingerprint_sha256": "51efc3d87cdffc4fb2869519ff4fa12b10ce179ba79d3976f6094cf741681c39",
    "provider_project_id": null,
    "billing_usage_tier": "UNVERIFIED",
    "inference_service_tier": "standard",
    "billing_context_verified": false
  },
  "temporal_provenance": {
    "request_started_at": "2026-10-06T07:42:27.726Z",
    "response_completed_at": "2026-10-06T07:42:37.024Z",
    "duration_ms": 9298
  },
  "input_provenance": {
    "treatment_sha256": "c84bdece59ecb9f665011fcec0ce8beca2d7f7a23b4dc3847395cf7ba878e8ff",
    "fixture_sha256": "a50f9b89c538d3466f55a1abe356da9a70cd6e16d61b2867328a48ee606e0586",
    "bound_prompt_sha256": "e3e61c66460745a59f0bc4b26e716eb14756713e7491c9a5edc48230fb0e1735",
    "receiver_output_schema_sha256": "935bf87b1ef86ac1df7490c7f5abe6d93892e89869f348671bd64c50b42e5537",
    "fixed_wrapper_sha256": "2132cb1c832b326ffa9942dff5d246e595207f19addc8e9bf8227dfb52744f0d"
  },
  "output_provenance": {
    "raw_response_sha256": "375bf372dd0ede636c98ed2994ce42badc2896bae15b45edf3e791120649e557",
    "raw_response_preserved_unmodified": true,
    "parsed_response_sha256": "2d5337080273c04e47172f2bf6fe791ee82e0d33b9dfe0c6c8e3fe5eeba9fc0d",
    "parsing_validation_status": "VALID"
  },
  "provider_receipt": {
    "provider_request_id": "Y6bEapjaOPvRz7IP7Ifz6Qc",
    "status_code": 200,
    "retry_ordinal": 0,
    "retry_reason": null,
    "x_gemini_service_tier": "standard"
  },
  "usage_realized_dose": {
    "reported_input_tokens": 3018,
    "reported_output_tokens": 256,
    "reported_total_tokens": 4162,
    "reported_thoughts_tokens": 888
  }
}
